title,authors,abstract,year,keywords,doi,url,type
Virtual machine tree task scheduling for load balancing in cloud computing,"Santosh Kumar Maurya, Suraj Malik, Neeraj Kumar","<p>The increasing number of publications towards cloud computing proves that much research and development has been done, especially for task scheduling. Organizations are eager to get more customized technology to run the most smoothly in the provision of visual cloud services for fruity users. As the circumstances of Covid indicate to technology that everyone should run digitally, the workload on machines increased. For workload solutions, organizations are trying to balance the situation with the successful operation of cloud services to use appropriate services/resources. Nevertheless, the issues are still to be resolved by researchers, so we respect all my friends who are putting a lot of effort into developing new techniques. A proposed paper is showing a new collation with the load balancing factor by implementing quality of service (QoS) and virtual machine tree (VMT). A CloudSim toolkit will then be used to compare them. A tree structure graph is included in the VMT algorithm to schedule tasks with the appropriate distribution on each machine. The QoS algorithm performs the task of scheduling based on the service required by the user with the best quality and satisfies the user.</p>",2023,"Cloud computing, Load balancing, Quality of service, Task scheduling, Virtual machine tree",10.11591/ijeecs.v30.i1.pp388-393,,publication
A Cloud-Based Platform for Service Restoration in Active Distribution Grids,"Haghgoo, Maliheh, Dognini, Alberto, Monti, Antonello","<p>In modern distribution grids, the access to the growing amount of data from various sources, the execution of complex algorithms on-demand, and the control of sparse actuators require on-demand scalability to support fluctuating workloads. Cloud computing technologies represent a viable solution for these requirements. To ensure that data can be exchanged and shared efficiently, as well as the full achievement of the cloud computing benefits to support the advanced analytic and mining required in smart grids, applications can be empowered with semantic information integration. This article adopts the semantic web into a cloud-based platform to analyze power distribution grids data and apply a service restoration application to re-energize loads after an electrical fault. The exemplary implementation of the demo is powered by FIWARE, which is based on open-source and customizable building blocks for future internet applications and services, and the SARGON ontology for the energy domain. The tests are deployed by integrating the semantic information, based on the IEC 61850 data model, in the cloud-based service restoration application and interfacing the field devices of the distribution grids. The platform performances, measured as network latency and computation time, ensure the feasibility of the proposed solution, constituting a reference for the next deployments of smart energy platforms.</p>",2023,"Smart Energy Platform, Service-oriented, Middleware, FIWARE, Service restoration, Cloud-based platform,, Semantic web, Publication, European Union (EU), H2020 Project, HYPERRIDE, GA 957788",10.1109/TIA.2022.3142661,,publication
Mental Health problem prediction of Tech Employees Using Machine Learning,"Siddharth Gupta, Pratibha Barua, Akanksha Kochhar, Vijay kumar, Rachna Narula","<p><em>In this era rapid societal changes, in addition to technology improvements, might pose problems and stress for the future generations. Individuals and society as a whole must place a high priority on mental health and well-being in order to reduce the detrimental effects of these developments. Individuals should give more importance to their own particular ideals and ambitions than just keeping up with society&#39;s pace. This kernel&#39;s goal is to identify the factors that affect someone&#39;s mental health based on this dataset. In 2014, attitudes towards mental health as well as the prevalence of mental health issues in the tech industry were assessed. This kernel seeks to create a methodical approach to comprehending mental Health in the workplace, in contrast to the other kernels. Is there a preliminary action that must be taken? There are typically many creative kernels on many issues, but only a small number are dedicated to addressing the issues of how to start on issues in medicine, particularly those relating to local knowledge. This section outlines prostate cancer and how to identify it. Additionally, we have completed Electronic Design Automation, created a dataset, and established a dataset.</em></p>",2023,"Mental health, Logistic Regression, K-nearest Neighbor Classifier, Decision Tree Classifier, Random Forest Classifier, Support Vector Machine, Artificial Neural Network",10.5281/zenodo.8337193,,publication
National Cloud Strategy 2023,"Digital Research Alliance of Canada, National Cloud Strategy Working Group","<p>The Digital Research Alliance of Canada exists to serve Canadian researchers – ultimately propelling Canada onto the international stage as a leader in the knowledge economy. Its coordination and funding of activities in advanced research computing (ARC), research data management (RDM) and research software (RS) will benefit Canadian researchers. This document establishes and communicates the organisation's unified cloud computing adoption strategy and direction. It identifies high-level approaches and methodologies upon which all impacted stakeholders agree.</p>",2023,"ARC, Advanced Research Computing, Capital Expenditure, CAPEX, Cloud Computing, Community Cloud, Commercial Cloud, Cloud Service Providers, CSPs, Cloud Infrastructure, Cloud Service",10.5281/zenodo.10214475,,publication
B-Cubed: Leveraging analysis-ready biodiversity datasets and cloud computing for timely and actionable biodiversity monitoring,"Groom, Quentin, Abraham, Laura, Adriaens, Tim, Breugelmans, Lissa, Clarke, David, Fernández, Miguel, Hendrickx, Louise, Hui, Cang, Kumschick, Sabrina, Martini, Matilde, McGeoch, Melodie, Metodiev, Teodor, Miller, Joe, Oldoni, Damiano, Pereira, Henrique, Preda, Cristina, Robertson, Tim, Rocchini, Duccio, Seebens, Hanno, Teixeira, Heliana, Trekels, Maarten, Wilson, John Ross, Yovcheva, Nikol, Zengeya, Tsungai, Desmet, Peter","<p>Effective biodiversity management and policy decisions require timely access to accurate and reliable information on biodiversity status, trends, and threats. However, the process of data cleaning, aggregation, and analysis is often time-consuming, convoluted, laborious, and irreproducible. Biodiversity monitoring across large areas faces challenges in evaluating data completeness and quantifying sampling effort. Despite these obstacles, unprecedented amounts of biodiversity data are being accumulated from diverse sources, aided by emerging technologies such as automatic sensors, eDNA, and satellite tracking.</p><p>To address these challenges, the development of tools and infrastructure is crucial for meaningful interpretations and deeper understanding of biodiversity data (Kissling et al. 2017). Furthermore, a significant delay exists in converting biodiversity data into actionable knowledge. Efforts have been made to reduce this lag through rapid mobilisation of biodiversity observations, digitization of collections (Nelson and Ellis 2018), and streamlined workflows for data publication (Reyserhove et al. 2020). However, delays still occur in the analysis, publication, and dissemination of data.</p><p>The B-Cubed project (Biodiversity Building Blocks for Policy)*1 proposes solutions to overcome these challenges. It implements the concept of Occurrence Cubes (Oldoni et al. 2020), which aggregate occurrence data along spatial, temporal and taxonomic dimensions. Cube generation will be available as a new service provided by the Global Biodiversity Information Facility (GBIF). By leveraging aggregated occupancy cubes as analysis-ready biodiversity datasets, we aim to enhance comprehension and reduce barriers to accessing and interpreting biodiversity data. Automation of workflows will provide regular and reproducible indicators and models that are open and useful to users. Additionally, the use of cloud computing offers scalability, flexibility, and collaborative opportunities for applying advanced data science techniques anywhere. Finally, close collaboration with stakeholders will inform us of the requirements for tools, increase impact, and facilitate the flow of information from primary data to the decision-making processes.</p>",2023,"biodiversity indicator, data cubes, Global Biodiversity Information Facility, policy support",10.3897/biss.7.110734,,publication
Quantifying quantitative correlation of provider selection influences cloud security,"Azlinda Abdul Aziz, Salyani Osman, Setyawan Widyarto, Suziyanti Marjudi, Nur Razia Mohd Suradi, Rahayu Handan","<p>The cloud computing has been able to help users to access the data easily and effectively. However, cloud security is highly emphasized to cloud users to ensure data is securely stored. The cloud security can be handled well by chosen trusted cloud service provider in getting high impact on the cloud security. The relationship between cloud security with the provider selection is much needed to ensure the extent to which data is securely stored in a cloud. Therefore, in this paper the quantitative method was conducted to measure the correlation between the selected the right cloud service provider influence the cloud security. Thus, knowledgeable person in having the experiences in using the cloud service was taking from two institution of higher learning (IHL) as a respondent. In addition, variability and normality data analysis was firstly conducted to obtain the consistency of the data. Then, the correlation between cloud security factor and provider selection factor was conducted using spearman correlation matrix and scatter graph in identifying the closely and significant the value in influencing between the factors. Thus, the correlation relationship analysis result shown the selected the right cloud provider&rsquo;s give higher impact to cloud security.</p>",2023,"Cloud advantage, Cloud computing, Cloud security, Data correlation, Provider selection",10.11591/ijeecs.v31.i3.pp1642-1647,,publication
OBLEA: A New Methodology to Optimise Bluetooth Low Energy Anchors in Multi-occupancy Location Systems,"López Ruiz, José L., Verdejo Espinosa, Ángeles, Montoro Lendínez, Alicia, Espinilla Estévez, Macarena","Nowadays, it is becoming increasingly important to understand the multiple configuration factors of BLE anchors in indoor location systems. This task becomes particularly crucial in the context of activity recognition in multi-occupancy smart environments. Knowing the impact of the configuration of BLE anchors in an indoor location system allows us to distinguish the interactions performed by each inhabitant in a smart environment according to their proximity to each sensor. This paper proposes a new methodology, OBLEA, that determines the optimisation of Bluetooth Low Energy (BLE) anchors in indoor location systems, considering multiple BLE variables to increase flexibility and facilitate transferability to other environments. Concretely, we present a model based on a data-driven approach that considers configurations to obtain the best performing configuration with a minimum number of anchors. This methodology includes a flexible framework for the indoor space, the architecture to be deployed, which considers the RSSI value of the BLE anchors, and finally, optimisation and inference for indoor location. As a case study, OBLEA is applied to determine the location of ageing inhabitants in a nursing home in Alcaudete, Jaén (Spain). Results show the extracted knowledge related to the optimisation of BLE anchors involved in the case study.",2023,"Indoor location system, Bluetooth Low Energy, Fog-Cloud computing, Sustainable development goals",10.3897/jucs.96878,,publication
An Enhanced Framework To Secure Big Data  Based on Hybrid Machine Learning  Technique:ANN-PSO,Assoc. Prof. Salim Raza Qureshi,"<p><strong>Abstract:</strong> With the advancement of smart devices and cloud computing, more and more public health data can be collected from various sources and analyzed in unprecedented ways. The enormous social and academic impact of this development has led to a global buzz for bigdata. Moreover, due to the massive data source, the security of big data in the cloud is becoming an important issue. In these days, various issues have arisen in the field of big data security, such as Infrastructure security, data confidentiality, data management and data integrity. In this paper, we propose a novel technique based on Artificial Neural Network-and Particle Swarm Optimization Algorithm (ANNPSO) for enabling a highly secured framework. The ANN-PSO method was created to predict health status from a database and its functions were selected from these data sets. The particle swarm optimization algorithm matches the ANN for better results by reducing errors. The results show the potential of the ANNPSO-based methodology for satisfactory health prediction results. This proposed approach will be tested using large medical data in a Hadoop environment. The proposed work will be carried out in the JAVA work phase.</p>",2023,"ANN-PSO, Accuracy, Classifier, Error, GOA,  Health condition.",10.35940/ijrte.F5385.039621,,publication
AUTOMATION OF HEALTHCARE APPLICATIONS BY INCORPORATION OF IT,Zamira Suyunova,"<p><em>The use of modern technologies in the public, business and healthcare sectors will be examined in this work. The styles of typical behavior of the various life segments indicated above tend to change as a result of recent technology breakthroughs which also negatively impact how these segments function. The technology provides mysterious ways in the realm of automation and shines light on particular sectors that call for acceptable and excellent services. By doing this, the effectiveness of the entire system that is put in place is improved in terms of credibility and accountability. A variety of documentations that are empirically applied in the field of IT are investigated to look into how the automation of the application areas is influenced by IT regarding the equation of responsibility. The investigation goes from the most basic types of transactions which entail lesser levels of automation to highly automated systems which include, among other things, technology that analyze biometric fingerprints. In the example, the accountable potential of IT automation is discussed for the various applications with the goal of examining the advantages of application automation while removing the potentials that are unaccountable and impede the functionality that may result from the use of the systems applications on the various fields. The necessity of striking a balance between the advantages of automated IT applications and the full automation process including any system that would tend to make applications less efficient or raise questions about accountability is emphasized frequently throughout this work.</em></p>",2023,"Information Technology (IT), Automation, Accountability, Public sector, Private sector, Healthcare sector",10.5281/zenodo.7726088,,publication
Formation of a minimum viable IT project team using the genetic algorithm,"Iryna Blyznyukova, Pavlo Teslenko","<p><em>The object of research is the process of forming an IT project team, in which the development technology is based on the technology of creating a minimum viable product (MVP) and design thinking (DT) technology. Such IT projects usually have a high content of innovation and require a special management technique, as well as a special approach to the properties of the project team.</em></p>

<p><em>The application of design thinking technology will require project team members to master the property of empathy for the customer&#39;s problems. Empathy is a property of the human representational system and cannot be acquired through education or training. If it exists, then this property can be developed thanks to special training. Therefore, there is a problem regarding the formation of the IT project team. The manager who is responsible for forming the team needs to make a decision to choose between the availability of technical competencies of the applicants, the ability to work in a team, and the presence of empathy. In addition to the outlined requirements for applicants, such a team must be self-managed and self-organized. This also adds a whole series of requirements to applicants for the IT project team. Usually, applicants possessing all the necessary properties in full do not exist. Therefore, the manager (expert) will need to make decisions about compromises in meeting all the project&#39;s requirements. In addition, the need for labor resources will change during the project life cycle (PLC). It is for this purpose that it is proposed to use a genetic algorithm (GA), which will allow finding a local extremum that will be optimal under the current conditions of the project to solve a multi-criteria problem. This will reduce the subjective component in the process of making project decisions, which in turn will increase the probability of successful completion of IT projects in conditions of uncertainty and dynamic changes.</em></p>

<p><em>The proposed method of forming an IT project team can be applied in practice in the form of information technology, to which in the form of a template it will be necessary to enter information about project requirements and the competency map of applicants. As a result, the GA will propose a decision regarding the quantitative and competent composition of the project team.</em></p>",2023,"IT project, minimal viable product creation technology, design thinking technology, minimal viable team, empathy, genetic algorithm",10.15587/2706-5448.2023.277930,,publication
"Acceleration-as-a-µService: A Cloud-native Monte-Carlo Option Pricing Engine on CPUs, GPUs and Disaggregated FPGAs","Diamantopoulos, Dionysios, Polig, Raphael, Ringlein, Burkhard, Purandare, Mitra, Weiss, Beat, Hagleitner, Christoph, Lantz, Mark, Abel, Francois","<p>The evolution of cloud applications into loosely-coupled microservices opens new opportunities for hardware accelerators to improve&nbsp;workload performance. Existing accelerator techniques for cloud sacrifice the consolidation benefits of microservices. This&nbsp;paper presents CloudiFi, a framework to deploy and compare accelerators as a cloud service. We evaluate our framework in the&nbsp;context of a financial workload and present early results indicating up to 485x gains in microservice response time.</p>

<p>&nbsp;</p>",2023,"Cloud computing, Monte Carlo methods, Graphics processing units, Pricing, Hybrid Cloud, FPGA",10.1109/CLOUD53861.2021.00096,,publication
Security and risk analysis in the cloud with software defined networking architecture,"Nagaraju Thatha, Venkata, Donepudi, Swapna, Aruna Safali, Miriyala, Phani Praveen, Surapaneni, Trong Tung, Nguyen, Ha Huy Cuong, Nguyen","<p>Cloud computing has emerged as the actual trend in business information technology service models, since it provides processing that is both costeffective and scalable. Enterprise networks are adopting software-defined networking (SDN) for network management flexibility and lower operating costs. Information technology (IT) services for enterprises tend to use both technologies. Yet, the effects of cloud computing and software defined networking on business network security are unclear. This study addresses this crucial issue. In a business network that uses both technologies, we start by looking at security, namely distributed denial-of-service (DDoS) attack defensive methods. SDN technology may help organizations protect against DDoS assaults provided the defensive architecture is structured appropriately. To mitigate DDoS attacks, we offer a highly configurable network monitoring and flexible control framework. We present a dataset shift-resistant graphic model-based attack detection system for the new architecture. The simulation findings demonstrate that our architecture can efficiently meet the security concerns of the new network paradigm and that our attack detection system can report numerous threats using real-world network data.</p>",2023,"Cloud computing, Distributed denial of service attack, secCloud, Software defined network, Virtual network",10.11591/ijece.v13i5.pp5550-5559,,publication
Sentiment Analysis of Tweets on Telangana State Government Flagship Schemes,"K. Bhuvaneshwari, Dr. S. A Jyothi Rani, Dr. V. V. Haragopal","<p><strong>Abstract: </strong>Over the last decade, the usage of social media has evolved to a greater extent. Today, social media platforms like Twitter, facebook, snapchat are vastly used to incept the opinions of public about a particular entity. Social media has become a great source of text data. Text analytics plays a crucial role on social media data to give answers to a wide variety of questions about public feedback on many issues or topics. The primary objective of this work is to analyse the public opinion or sentiment in social media on Telangana state government welfare schemes. The purpose of sentiment analysis is to find opinions from tweets and extract sentiments from them and find their polarity, i.e., positive, neutral or negative. Here we are using twitter as it has gained much popularity and media attention. The first step is to extract the tweets on particular schemes through Twitter API and Python language followed by cleaning and pre- processing steps of the raw tweets. Then tfidf vectoriser was invoked for feature extraction and creation of bag of words and finally sentiment polarity scores were obtained by using VADER (Valence Aware Dictionary and sEntiment Reasoner), lexicon and rule-based sentiment analysis tool.</p>",2023,"Sentiment Analysis, Twitter, Vader, Lexicon, Government Schemes",10.35940/ijeat.A3794.1012122,,publication
E-LEARNING DEVELOPMENT EXPERIENCE IN EUROPE,"Shmatko, Sergey Gennadievich, Lovyannikov, Denis Gennadievich","<p><em>Goal. The subsection is part of the Erasmus + Jean Monnet project &quot;Digital Economy and Education: European Experience&quot;. Its purpose is to describe the experience of the development of e&ndash;learning, identify problems, consider the experience of Europe in terms of this issue and outline development trends. Structure / methodology / approach. The paper outlines the main problems of e-learning in Europe, as well as the experience of using mass open online courses, their advantages and development trends. A separate part of the subsection is devoted to the role of free software in education and provides the experience of the European Union. The final part examines continuing education in Europe, the degree of its influence on the level of education, as well as the state of the country&#39;s economy. Results. The results of the study can be used in the development of effective measures of state support for stimulating the market of additional educational programs and the development of systems for independent assessment of the level of education and recognition of qualifications according to existing competencies. This will lead to an increase in labor productivity. This study is a generalization of data on the use of mass open online courses in Europe, identification of problems in the development of this technology, description of new trends, as well as identification of the value of this technology.</em></p>",2023,"e-education, mobile technologies, MOOK, digitalization, LMS.",10.5281/zenodo.8079019,,publication
INFORMATION AND COMMUNICATION TECHNOLOGIES AND THEIR SIGNIFICANCE,Muhriddin Kuzratov,"<p>The article describes information technology, information communication channels, modern information and communication technologies (ICT), tools, their importance, classification and characteristics.</p>",2023,"ICT, cloud computing, software, hardware, economic operations (transactions), communication technologies, database, telephone, mobile technologies, multimedia technologies, electronic mail (e-mail), conference, teletext, web camera, Internet",10.5281/zenodo.7501091,,publication
Big Data Platforms and Tools for Data Analytics in the Data Science Engineering Curriculum,Yuri Demchenko,"<p>This paper presents experiences of development and teaching courses on Big Data Infrastructure Technologies for Data Analytics (BDIT4DA) as a part of the general Data Science curricula. The authors built the discussed course based on the EDISON Data Science Framework (EDSF), in particular, Data Science Body of Knowledge (DS-BoK) related to Data Science Engineering knowledge area group (KAG-DSENG). The paper provides overview of the cloud based platforms and tools for Big Data Analytics and stresses importance of including into curriculum the practical work with clouds for future graduates or specialists workplace adaptability. The paper discusses a relationship between the DSENG BoK and Big Data technologies and platforms, in particular Hadoop based applications and tools for data analytics that should be promoted through all course activities: lectures, practical activities and self-study.&nbsp;</p>",2023,"EDISON Data Science Framework (EDSF), Big Data Infrastructure Technologies, Data Science Body of Knowledge (DS-BoK), Data Science Engineering, Hadoop ecosystem, Cloud Computing",10.5281/zenodo.7538483,,publication
