title,authors,abstract,year,keywords,doi,url,type
D2.2_Research Procurement Case Studies,Garavelli Sara,"<p>Digital transformation is absolutely crucial to any organisation whether public or private. It is at the very core of the digital single market, in order to ensure Europe reaps the socio-economic benefits of new technologies. Cloud computing has the potential to reduce IT expenditure and to boost organisational agility while at the same time expanding the scope for the delivery of flexible high-quality new services.<br />
Barriers to the adoption of cloud services range, shifting to new procurement processes matching the cloud&rsquo;s on-demand model, to lack of trust &amp; security, and finally from lack of mature technical standards to complex legal terms and fear of vendor lock-in. Overcoming these barriers is key to boosting public sector productivity and efficiency, and to meet the demands of a new set of users in a way that ensures secure and reliable and compliance with institutional requirements.<br />
This document describes a set of case studies documenting how public sector organisations worldwide have either carried out a process to procure cloud services, or are considering doing so. The experiences vary in term of success and offer insights into how the procurement of cloud services is impacting their current processes.<br />
Thirteen case studies are included; nine describe the experience of public sector organisations, which have procured different types of cloud services for different amounts of money; four others report the considerations of organisations that considering cloud procurement.<br />
The procurement experiences described in these case studies showcase that even if almost all of the organisations have the same procurement procedures, cloud procurement can be approached in many different ways. This is mainly due to different maturity levels with respect to cloud adoption in these organisations. However, as a common factor, almost all the organisations share the same challenges and agree on what would be the actions needed to quicken the cloud procurement process.<br />
Among the key lessons learned from the case studies are the following:<br />
&Oslash; Having the right skill set is fundamental for managing a successful procurement process;<br />
&Oslash; Legal aspects and Data Processor Agreements are fundamental for public entities to procure;<br />
&Oslash; Exit strategies when moving to the cloud should be carefully defined to avoid vendor lock-in;<br />
&Oslash; Writing an effective tender is of paramount importance: when writing tender specifications it is recommended to have some pre-discussions with potential providers to better understand the solutions they can offer;<br />
&Oslash; Standard and well-defined specifications work best;<br />
&Oslash; Marketing the tender is the first step to ensure that at least the minimum number of responses are received;<br />
&Oslash; Joint procurement actions can reduce the cost of developing specifications &amp; contracts and to improve purchasing conditions due to combined capacity;<br />
In addition, at least five wishes shared by all the procurers emerge from the case studies:<br />
1. More transparency in cataloguing services;</p>

<p>2. Catalogues of cloud service providers available for procurers&rsquo; consultation;<br />
3. A standalone test that could be used to verify the suitability of the services offered by the suppliers;<br />
4. Sample templates and guiding graphs to write public tenders;<br />
5. Accounting of cloud resources and comparing costs supported by standards.<br />
The outcomes of the case studies analysis is fundamental to the analysis of the cloud service procurement best practices performed in D3.2 and feeds the PICSE Roadmap on Cloud Service Procurement for public research organisations (D2.3).</p>",2016,"PICSE, Procurement, Case Studies, Cloud, Public Research Organizations, Best Practices ",10.5281/zenodo.46973,,publication
STUDY OF A SECURE AND PRIVACY-PRESERVING OPPORTUNISTIC COMPUTING FRAMEWORK FOR MOBILE-HEALTHCARE EMERGENCY,"Pramod B. Deshmukh, Nilesh N. Wani, Laxmikant S. Malphedwar, Deepali A. Ghanwat","<p><em>With the pervasiveness of smart phones and the advance of wireless body sensor networks (BSNs), mobile Healthcare (m-Healthcare), which extends the operation of Healthcare provider into a pervasive environment for better health monitoring, has attracted considerable interest recently. However, the flourish of m-Healthcare still faces many challenges including information security and privacy preservation. In this paper, we propose a secure and privacy-preserving opportunistic computing framework, called SPOC, for m-Healthcare emergency. With SPOC, smart phone resources including computing power and energy can be opportunistically gathered to process the computing-intensive personal health information (PHI) during m-Healthcare emergency with minimal privacy disclosure. In specific, to leverage the PHI privacy disclosure and the high reliability of PHI process and transmission in m-Healthcare emergency, we introduce an efficient user-centric privacy access control in SPOC framework, which is based on an attribute-based access control and a new privacy-preserving scalar product computation (PPSPC) technique, and allows a medical user to decide who can participate in the opportunistic computing to assist in processing his overwhelming PHI data. Detailed security analysis shows that the proposed SPOC framework can efficiently achieve user-centric privacy access control in m-Healthcare emergency. In addition, performance evaluations via extensive simulations demonstrate the SPOC’s effectiveness in term of providing high-reliable-PHI process and transmission while minimizing the privacy disclosure during m-Healthcare emergency.</em></p>",2016,"Security, Healthcare, Opportunistically, PHI & SPOC",10.5281/zenodo.192369,,publication
