title,authors,abstract,year,keywords,doi,url,type
Cyber Security in E-Commerce Sectors,Mr. Gunawan Widjaja,"<ol>
	<li>&nbsp;</li>
</ol>

<p>&nbsp;&nbsp;&nbsp;&nbsp;&nbsp;&nbsp;&nbsp;&nbsp;&nbsp;&nbsp;&nbsp; The convenience and efficiency it offers have revolutionized the global economy, bringing products and services to our fingertips with just a few clicks. However, this convenience also brings forth a host of security challenges that cannot be ignored.</p>

<p>This book, &quot;Cyber Security in E-commerce,&quot; delves into the intricate realm where technology and commerce intersect, focusing on the critical aspects of security that underpin the functionality and reliability of online transactions. As the digital landscape evolves and businesses increasingly migrate to online platforms, the need to fortify these platforms against an array of cyber threats has never been more urgent.</p>

<p>The introductory chapter sets the stage by contextualizing e-commerce within the sphere of security concerns, emphasizing the need for systemic security practices and collaborative governance models. It sheds light on the potential risks that stem from the widespread adoption of electronic commerce, underlining the significance of robust security measures. Subsequent chapters delve into the underpinning technologies, ranging from e-commerce network technologies and blockchain to the emergent domains of virtual reality, cloud computing, and information security. These chapters equip readers with an understanding of the technological foundations necessary to secure the e-commerce landscape.</p>

<p>&nbsp;</p>

<p>The practical application of security principles takes center stage in another segment, elucidating the core tenets of confidentiality, integrity, and availability. The exploration spans the entire spectrum of e-commerce planning, development, and maintenance, ensuring that security remains paramount throughout. Moreover, the book navigates the intricate waters of combating Distributed Denial of Service (DDoS) attacks, detailing security solutions and testing methodologies.</p>

<p>&nbsp;</p>

<p>A pivotal chapter maps out the implementation of secure e-commerce websites, offering insights into security zones, firewalls, and intrusion detection systems. The importance of management and monitoring, whether in-house or outsourced, is examined in the context of maintaining a secure online presence. Real-world case studies, the cornerstone of this book, provide tangible examples of security breaches, thereby emphasizing the need for stringent security measures in e-commerce endeavors.</p>

<p>&nbsp;</p>

<p>In the ever-evolving world of e-commerce, security stands as the linchpin that safeguards transactions, privacy, and trust. &quot;Cyber Security in E-commerce&quot; is an indispensable resource that empowers readers to navigate the complex landscape of online business while bolstering their understanding of the strategies and technologies that can safeguard against cyber threats. As we embark on this enlightening journey, the book serves as a beacon of knowledge, guiding readers through the intricate web of cyber security in e-commerce and illuminating the pathways to a secure and prosperous digital commerce landscape.</p>

<p>&nbsp;&nbsp;&nbsp;&nbsp;&nbsp;&nbsp;&nbsp;&nbsp;&nbsp;&nbsp;&nbsp; Any unintentional errors, typos, omissions, or improvements to this work are much appreciated.</p>",2023,"Cyber Security , E-Commerce Sectors",10.5281/zenodo.8429484,,publication
A Review on Key Features and Novel Methods for Video Summarization,"Vinsent Paramanantham, Dr. S. Suresh Kumar","<p><strong>Abstract: </strong>In this paper, we discuss techniques, algorithms, evaluation methods used in online, offline, supervised, unsupervised, multi-video and clustering methods used for Video Summarization/Multi-view Video Summarization from various references. We have studied different techniques in the literature and described the features used for generating video summaries with evaluation methods, supervised, unsupervised, algorithms and the datasets used.We have covered the survey towards the new frontier of research in computational intelligence technique like ANN (Artificial Neural Network) and other evolutionary algorithms for VS using both supervised and unsupervised methods. We highlight on single, multi-video summarization with features like video, audio, and semantic embeddings considered for VS in the literature. A careful presentation is attempted to bring the performance comparison with Precision, Recall, F-Score, and manual methods to evaluate the VS.</p>",2023,"Video Summarization, Multi-View Video Summarization, Online Offline Video Highlighting, Key Frames, Sparse Coding, Feature Extraction, Sparse Land, CNN, RNN, LSTM.",10.35940/ijeat.F3737.0212323,,publication
ATHENS course DIGITAL SIGNAL AND IMAGE PROCESSING WITH APPLICATIONS 2023,"CURVO, Pedro, Le Blanc, Raphael, MACHADO, Maria Carolina, Sciarretta, Lorenzo, GEFFLAUT, Vincent, PIMENTA, Joana, WIŚNIEWSKI, Filip, EJARQUE BUENO, Lidia, NIEDZIAŁEK, Piotr, GAO, Shan, BIRRA, Pedro, FIGUEIREDO, Ivan Dos Santos, MOLČANOVÁ, Alexandra, SCHÄTZ, Martin, PROCHÁZKA, Aleš","<p>The ATHENS (Advanced Technology Higher Education Network, Socrates) week was established with the support of the European Communities SOCRATES Programme receiving an annual subsidy of 50&nbsp;000 Euros from 1997-2001. Today, the Programme is mainly founded by contributions from the member institutions.</p><p>The ATHENS Programme is aimed at carrying out intensive specialization courses, given at each member institution during one or two defined periods (""Sessions"") of the academic year (November and March), enabling students to attend one of the courses offered by the network universities during 7 days. This experience, in many cases, gives students the desire to carry out studies of a longer duration (MSc and PhD levels) at an institution different from their home institution and thus facilitates exchanges between students of the major European technological institutions.</p><p>&nbsp;</p><p>The ATHENS course <strong>DIGITAL SIGNAL AND IMAGE PROCESSING WITH APPLICATIONS</strong>, scheduled from November 20 to 24, 2023, offers an intensive program focused on signal processing and algorithmization within the MATLAB environment. The daily schedule is divided into three blocks - A, B, and C - with a variety of lectures, case studies, practical projects, and excursions. Here is a summary of the program:</p><p><strong>Monday (November 20, 2023):</strong></p><ul><li><strong>BLOCK A (9:00-12:00):</strong><ul><li>Lecture: Introduction to signal processing, MATLAB algorithmization, visualization, programming tools, structured arrays, data processing methods, linear algebra, least square method, approximation, and interpolation by Prof. A. Procházka, CSc.</li></ul></li><li><strong>BLOCK B (13:00-14:30):</strong><ul><li>Lecture: Discrete Fourier transform, properties, frequency components detection, window functions, applications by Prof. A. Procházka, CSc.</li></ul></li><li><strong>BLOCK C (14:30-16:00):</strong><ul><li>Case Study 1: DSP in neurology - Gait symmetry analysis by Bc. A. Molcanová.</li></ul></li></ul><p><strong>Tuesday (November 21, 2023):</strong></p><ul><li><strong>BLOCK A (9:00-12:00):</strong><ul><li>Lecture: Z-transform, difference equations, system description by Prof. A. Procházka, CSc.</li></ul></li><li><strong>BLOCK B (13:00-14:30):</strong><ul><li>Lecture: DFT, short time Fourier transform, frequency transfer function by Prof. A. Procházka, CSc.</li></ul></li><li><strong>BLOCK C (14:30-16:00):</strong><ul><li>Case Study 2: Sensors and data acquisition - Signal processing methods by Ing. M. Schatz, PhD.</li></ul></li></ul><p><strong>Wednesday (November 22, 2023):</strong></p><ul><li><strong>BLOCK A (9:00-12:00):</strong><ul><li>Lecture: Digital filtering using difference equations, FIR and IIR filters, frequency domain filtering by Prof. A. Procházka, CSc.</li></ul></li><li><strong>BLOCK B (13:00-14:30):</strong><ul><li>Lecture: Discrete Wavelet transform, signal decomposition, de-noising, reconstruction by Prof. A. Procházka, CSc.</li></ul></li><li><strong>BLOCK C (15:15 onwards):</strong><ul><li>Visit to the Technical Museum</li></ul></li></ul><p><strong>Thursday (November 23, 2023):</strong></p><ul><li><strong>BLOCK A (9:00-12:00):</strong><ul><li>Case Study 3: Deep learning in MATLAB environment - Computational intelligence in recognition problems by Ing. J. Jirkovský, PhD.</li></ul></li><li><strong>BLOCK B (13:00-14:30):</strong><ul><li>Excursion to Robotics and Machine Perception, Cloud Computing, and Intelligent Robots Departments, CTU CIIRC. Topics include computer vision, conversational AI, and mobile robots with contributions from Prof. V. Hlavác, PhD, Ing. J. Šedivý, CSc, and Ing. K. Košnar, PhD.</li></ul></li><li><strong>BLOCK C (14:30-16:00):</strong><ul><li>Projects: DSP in signal and image processing.</li></ul></li></ul><p><strong>Friday (November 24, 2023):</strong></p><ul><li><strong>BLOCK A (9:00-12:00):</strong><ul><li>DSP Applications: History and Interdisciplinary Applications of Computational Intelligence and Digital Signal and Image Processing by Prof. A. Procházka, CSc.</li></ul></li><li><strong>BLOCK B (Evaluation/12:00):</strong><ul><li>List of participants and final presentations, featuring the Scientific Board: Prof. A. Procházka, CSc, Ing. M. Yadollahi, PhD, RNDr. P. Cejnar, PhD, Ing. M. Schätz, PhD.</li></ul></li></ul><p>This comprehensive program covers a range of topics in signal processing, offering participants a mix of theoretical knowledge, practical skills, and exposure to real-world applications.</p>",2023,"digital signal processing, digital image processing, matlab, ATHENS",10.5281/zenodo.10203848,,event
Functionality Report: MCRA and low-end user apps,"van Klaveren, Jacob, Kolbaum, Anna, Peschko, Kerstin, Czach, Joanna","<p>Food may contain hazardous substances such as contaminants or residues from pesticides or food packaging materials. Food risk assessment requires different types of data e.g., chemical concentration, food consumption and health hazard data. Well-established datasets exist such as organized by the European Food Safety Authority (EFSA) and Member States data collection framework composed of national residue data and food consumption data collections, but so do emerging datasets, including data from total diet studies (TDS). TDS data can be very useful for food risk assessment because hazardous chemicals are measured in food as consumed. Data harmonization and data conversion are therefore essential steps in the assessment process. In addition, food risk assessment is complex and is constantly evolving, adopting different statistical approaches and ICT environments (e.g. cloud computing) as the discipline develops. Therefore, it is useful to develop demonstrator software to facilitate understanding and guide different user groups including risk assessors and low-end-users how to use e-services and the relevant data sets in international risk assessment or for training purposes.</p>

<p>The FNS-Cloud project created e-services that enable two types of user communities; low-end users (such as consumers or potential professional users that are not experts for TDS concept or exposure assessment) and researchers/risk assessors (experts and high-end users), to evaluate and visualize chemical food safety data after applying international risk assessment. Using the tools and services developed low-end users will be able to use concentration&nbsp;data from total diet studies (TDS) within the decision-making processes in their daily life, e.g., food purchasing and food choice. High-end users will be able to use TDS or monitoring data for higher-tier and more complex risk assessments analyses. Specifically, the latter approach will use the probabilistic assessment with the Monte Carlo Risk Assessment (MCRA) tool.</p>

<p>With the tools and services developed within FNS-Cloud there are five phases to this work split over WP 4 (Use cases) and WP 5 (Demonstrators), covering specification, implementation and testing (Task 4.3) and improvement and evaluation (in WP 5). For each use case, demonstrator software has been developed. In Part I of this report the functionalities of the MCRA TDS demonstrators and the MCRA Mixture Risk Assessment demonstrator are described &ndash; the high-end user tool. The demonstrators were tested by representatives of three groups namely 1) Academia, 2) public health institutes performing TDS (TDS centres) and 3) industry. Each group was initially trained to use the tools and e-services and after training the functionalities of the tools were discussed, and representatives of these groups also outlined their future user needs. Overall, they perceived the functionalities very positively, they understood the data formats and how their own private data could be used in the MCRA-software. Those in academia were able to familiarize themselves with new concepts in risk assessment using TDS data sets from three European Member States.</p>

<p>Finally the TDS network centres emphasized their needs to work in a harmonised approach. The first TDS demonstrator enabled them to organize their TDS data in internationally agreed formats such as the Standard Sample Description (SSD) format used by EFSA and the European Member States. Part II of this report describes the low-end user mobile app called FoodMagnifier. The aim of this app is to inform the general public about the content data of contaminants and residues in foods, based on the findings of Total Diet Studies. The app presents this information to the user in visual formats using graphs and charts, comparing the amount of substance in different types of foods. In addition to the content information, background information is also included, such as a description of the chemical, exposure statistics, health-based and toxicological reference values, and the role that different food categories play in dietary exposure. This deliverable also describes two usability tests that were performed with a wide variety of users, the results of those tests, as well as the improvements of the app based on those and the future plans.</p>",2023,"Monte Carlo Risk Assessment, Pesticides, Packaging materials, Total diet studies, Consumer tools",10.5281/zenodo.8262468,,publication
A proposed approach to enhance user PIN in the mobile money ecosystem in Ghana,"Kelly, Afful Ekow, Palaniappan, Sellappan","<p>The use of only numeric numbers as the base for the USSD PIN rather than alphanumeric was one of the security risks in the USSD mobile money services. The study objective is to assess the security threats posed by user PINs in the mobile money banking ecosystem and to enhance the service quality of the existing mobile money service with its high level of security threats prone to the mobile money industry. The study aims to shed light on the consumer acceptability requirements for mobile banking in particular areas of the consumer usage pattern, which will inform the industry players to strengthen such areas in consumer interest. This will help both the telecoms to understand the individuals and customise services based on the service needs of users of their product. This will aid the operators to cut costs and help improve the security infrastructure in other countries to cover to rope in more users, and to serve the unbanked in the hinterlands of the country. There is a growing demand for the adoption of mobile money services in Ghana. However, there is insufficient research to understand the risk associated with the adoption of the service. It is on this trend that, the study sought to reveal and understand the threat in the nature of user PIN used in the mobile money service. This study encapsulates, with the extension on demographic scope, which included workers, students, employed and unemployed who have adopted mobile money services the study adopted an exploratory method, to understand the main threats of the user PIN in relation to the mobile money application adopted in Ghana. This also included a survey question for users&rsquo; responses on the nature of use. The study included 57 participants to uncover the vulnerability of users&rsquo; PINs in mobile money services. The study&rsquo;s findings revealed that the length could be increased. The current size of the PIN stack was set to four for convenience and user-friendliness, with little thought given to the threat such a length could pose in financial transactions involving mobile money banking. The mobile money PIN solution provided will enable users not to be worried n about their accounts should users end up losing their handset and otherwise potentially harm their handsets because the merchandise is completely secure. The system is safeguarded by cutting-edge secure authentication, but also users&rsquo; funds are always secure because each transaction requires a secured alphanumeric password. The mobile payment process delivers individual clients with enhanced security but also lowers the need of carrying physical money but also ensures easy prompt payment of transactions of utilities. Individuals utilizing such services will manage to pay one&rsquo;s bill payments from the comfort of their place of arbour and making it even easier to do so. The use of only a numeric key for PIN was far more convenient for users, but it also made them more vulnerable to attacks. The standard PIN length in the current USSD mobile money application was four numeric keys. The indication was that the PIN length was too simple for a simple system to break through. The study proposed solution where mobile money users can increase their user PIN to six characters, and include alphanumeric keys. The study will help reduce the increasing threat of mobile money fraud in the FinTech industry.</p>",2023,"fraud, mobile money, mobile security, personal identification number, SMS threat, unstructured supplementary service data",10.47451/inn2022-11-01,,publication
